{
  "id": "brick",
  "name": "Brick Schema",
  "fullName": "Brick Schema",
  "resourceType": "ontology",
  "summary": "Brick Schema is an open OWL ontology for modeling buildings, infrastructure, and their systems, including spaces, equipment, power distribution, cooling, HVAC, and sensors. It provides a formal semantic foundation to represent and reason over the physical and infrastructural structure of AI factories and data centers.",
  "knowledge": {
    "domain": "product.operations",
    "basis": "editorial",
    "confidence": "clear"
  },
  "publisher": "Brick Consortium",
  "publisherType": "consortium",
  "kind": "ontology",
  "layer": "domain",
  "topics": [
    "building systems",
    "HVAC",
    "electrical",
    "points",
    "telemetry"
  ],
  "version": {
    "label": "Brick v1.4.4 (v1.5.0 release candidates in progress)",
    "date": null,
    "status": "published"
  },
  "maturity": "stable",
  "license": {
    "name": "BSD-3-Clause",
    "access": "open",
    "url": "https://github.com/BrickSchema/Brick",
    "reviewStatus": "not-assessed",
    "commercialReuse": "unknown"
  },
  "links": {
    "official": "https://brickschema.org/",
    "repository": "https://github.com/BrickSchema/Brick",
    "namespace": "https://brickschema.org/schema/Brick#"
  },
  "formats": [
    "OWL",
    "RDF/Turtle",
    "SHACL"
  ],
  "industries": [
    "high-tech",
    "infrastructure-energy-materials",
    "architecture-engineering-construction"
  ],
  "useCases": [
    "ai-factories"
  ],
  "capabilities": [
    "iot-monitoring",
    "spatial-facility",
    "digital-twin",
    "energy-management"
  ],
  "classificationBasis": {
    "industries": "editorial",
    "capabilities": "editorial"
  },
  "physicalAi": [],
  "verification": {
    "checkedOn": "2026-10-15",
    "status": "verified",
    "sources": [
      {
        "url": "https://github.com/BrickSchema/Brick/releases",
        "title": "Brick releases",
        "type": "publisher-repository",
        "supports": [
          "version"
        ]
      },
      {
        "url": "https://brickschema.org/",
        "title": "Brick Schema",
        "type": "official-documentation",
        "supports": [
          "identity",
          "scope",
          "licence"
        ]
      }
    ],
    "notes": ""
  },
  "editorialReview": {
    "reviewedOn": "2026-10-16",
    "reviewer": "atlas-editors"
  },
  "origin": "v1",
  "legacy": {
    "name": "Brick Schema",
    "category": "AI Factory",
    "publisher": "Brick Consortium",
    "official": "https://brickschema.org/",
    "endObjects": [
      "AI Factories"
    ],
    "imds": [
      "Infrastructure System Architecture",
      "Compute Performance & Sustainability"
    ],
    "description": "Brick Schema is an open OWL ontology for modeling buildings, infrastructure, and their systems, including spaces, equipment, power distribution, cooling, HVAC, and sensors. It provides a formal semantic foundation to represent and reason over the physical and infrastructural structure of AI factories and data centers.",
    "parentOntology": "AI Factory (End-Object Ontology)",
    "stabilityStatus": "stable",
    "usageStatus": "open",
    "hasInternalWikiLink": true
  },
  "engineeringUses": [
    "Describing HVAC, electrical and metering points so analytics can run across buildings",
    "Linking sensor time series to the equipment and spaces they monitor"
  ],
  "limitations": []
}
